{
  "schema_version": 1,
  "last_verified": "2026-10-02",
  "id": "acl",
  "edition": 2027,
  "name": "ACL 2027",
  "short_name": "ACL",
  "subtitle": "Association for Computational Linguistics · Kyoto",
  "symbol": "text.bubble.fill",
  "official_url": "https://2027.aclweb.org/",
  "time_zone": "Asia/Tokyo",
  "default_event_id": "acl.conference",
  "events": [
    {
      "id": "acl.arr",
      "title": "ARR 投稿截止",
      "compact_title": "ACL 投稿",
      "at": "2027-01-04T23:59:59-12:00",
      "date_label": "2027 年 1 月 4 日 23:59:59 AoE",
      "detail_label": "北京时间 2027 年 1 月 5 日 19:59:59",
      "symbol": "doc.badge.clock"
    },
    {
      "id": "acl.review",
      "title": "评审意见公布",
      "compact_title": "ACL 评审",
      "at": null,
      "date_label": "官方尚未公布",
      "detail_label": "公布后替换历史预测",
      "symbol": "doc.text.fill",
      "historical_key": "review_release",
      "target_year": 2027
    },
    {
      "id": "acl.rebuttal",
      "title": "作者回复截止",
      "compact_title": "ACL 回复",
      "at": null,
      "date_label": "官方尚未公布",
      "detail_label": "公布后替换历史预测",
      "symbol": "bubble.left.and.bubble.right.fill",
      "historical_key": "rebuttal_deadline",
      "target_year": 2027
    },
    {
      "id": "acl.commitment",
      "title": "ACL Commitment 截止",
      "compact_title": "ACL 承诺",
      "at": null,
      "date_label": "官方尚未公布",
      "detail_label": "公布后再更新提醒",
      "symbol": "checkmark.seal",
      "historical_key": "commitment_deadline",
      "target_year": 2027
    },
    {
      "id": "acl.decision",
      "title": "最终结果公布",
      "compact_title": "ACL 终审",
      "at": null,
      "date_label": "官方尚未公布",
      "detail_label": "公布后替换历史预测",
      "symbol": "checkmark.seal.fill",
      "historical_key": "final_decision",
      "target_year": 2027
    },
    {
      "id": "acl.conference",
      "title": "会议开幕",
      "compact_title": "ACL 开会",
      "at": "2027-08-17T00:00:00+09:00",
      "date_label": "2027 年 8 月 17–22 日",
      "detail_label": "日本 · 京都",
      "symbol": "building.columns.fill"
    }
  ]
}
