{
  "schema_version": 1,
  "last_verified": "2026-08-14",
  "id": "emnlp",
  "edition": 2027,
  "name": "EMNLP 2027",
  "short_name": "EMNLP",
  "subtitle": "Empirical Methods in NLP · Mexico/Central America (tentative)",
  "symbol": "text.quote",
  "official_url": "https://www.aclweb.org/portal/content/joint-call-workshops-proposals-2027",
  "time_zone": "America/Mexico_City",
  "default_event_id": "emnlp.paper",
  "events": [
    {
      "id": "emnlp.paper",
      "title": "ARR 投稿截止",
      "compact_title": "EMNLP 投稿",
      "at": null,
      "date_label": "官方尚未公布",
      "detail_label": "公布后替换历史预测",
      "symbol": "doc.badge.clock",
      "historical_key": "paper_deadline",
      "target_year": 2027
    },
    {
      "id": "emnlp.review",
      "title": "评审意见公布",
      "compact_title": "EMNLP 评审",
      "at": null,
      "date_label": "官方尚未公布",
      "detail_label": "公布后替换历史预测",
      "symbol": "doc.text.fill",
      "historical_key": "review_release",
      "target_year": 2027
    },
    {
      "id": "emnlp.rebuttal",
      "title": "作者回复截止",
      "compact_title": "EMNLP 回复",
      "at": null,
      "date_label": "官方尚未公布",
      "detail_label": "公布后替换历史预测",
      "symbol": "bubble.left.and.bubble.right.fill",
      "historical_key": "rebuttal_deadline",
      "target_year": 2027
    },
    {
      "id": "emnlp.commitment",
      "title": "EMNLP Commitment 截止",
      "compact_title": "EMNLP 承诺",
      "at": null,
      "date_label": "官方尚未公布",
      "detail_label": "公布后替换历史预测",
      "symbol": "checkmark.seal",
      "historical_key": "commitment_deadline",
      "target_year": 2027
    },
    {
      "id": "emnlp.decision",
      "title": "最终结果公布",
      "compact_title": "EMNLP 终审",
      "at": null,
      "date_label": "官方尚未公布",
      "detail_label": "公布后替换历史预测",
      "symbol": "checkmark.seal.fill",
      "historical_key": "final_decision",
      "target_year": 2027
    },
    {
      "id": "emnlp.conference",
      "title": "会议开幕",
      "compact_title": "EMNLP 开会",
      "at": null,
      "date_label": "暂定 2027 年 11 月上旬",
      "detail_label": "墨西哥或中美洲 · 具体地点待公布",
      "symbol": "building.columns.fill",
      "historical_key": "conference_start",
      "target_year": 2027
    }
  ]
}
