{
  "schema_version": 1,
  "last_verified": "2026-08-14",
  "id": "neurips",
  "edition": 2027,
  "name": "NeurIPS 2027",
  "short_name": "NeurIPS",
  "subtitle": "Neural Information Processing Systems · Europe",
  "symbol": "cpu.fill",
  "official_url": "https://neurips.cc/Conferences/FutureMeetings",
  "time_zone": "Europe/Paris",
  "default_event_id": "neurips.paper",
  "events": [
    {
      "id": "neurips.abstract",
      "title": "摘要提交截止",
      "compact_title": "NeurIPS 摘要",
      "at": null,
      "date_label": "官方尚未公布",
      "detail_label": "2027 年会址仅公布为欧洲",
      "symbol": "doc.text",
      "historical_key": "abstract_deadline",
      "target_year": 2027
    },
    {
      "id": "neurips.paper",
      "title": "全文提交截止",
      "compact_title": "NeurIPS 全文",
      "at": null,
      "date_label": "官方尚未公布",
      "detail_label": "公布后替换历史预测",
      "symbol": "paperplane.fill",
      "historical_key": "paper_deadline",
      "target_year": 2027
    },
    {
      "id": "neurips.review",
      "title": "评审意见公布",
      "compact_title": "NeurIPS 评审",
      "at": null,
      "date_label": "官方尚未公布",
      "detail_label": "公布后替换历史预测",
      "symbol": "doc.text.fill",
      "historical_key": "review_release",
      "target_year": 2027
    },
    {
      "id": "neurips.rebuttal",
      "title": "作者回复截止",
      "compact_title": "NeurIPS 回复",
      "at": null,
      "date_label": "官方尚未公布",
      "detail_label": "公布后替换历史预测",
      "symbol": "bubble.left.and.bubble.right.fill",
      "historical_key": "rebuttal_deadline",
      "target_year": 2027
    },
    {
      "id": "neurips.decision",
      "title": "最终结果公布",
      "compact_title": "NeurIPS 终审",
      "at": null,
      "date_label": "官方尚未公布",
      "detail_label": "公布后替换历史预测",
      "symbol": "checkmark.seal.fill",
      "historical_key": "final_decision",
      "target_year": 2027
    },
    {
      "id": "neurips.conference",
      "title": "会议开幕",
      "compact_title": "NeurIPS 开会",
      "at": null,
      "date_label": "日期尚未公布",
      "detail_label": "欧洲 · 具体城市待公布",
      "symbol": "building.columns.fill",
      "historical_key": "conference_start",
      "target_year": 2027
    }
  ]
}
