{
  "schema_version": 1,
  "last_verified": "2026-10-12",
  "id": "www",
  "edition": 2027,
  "name": "WWW 2027",
  "short_name": "WWW",
  "subtitle": "The ACM Web Conference · Dublin",
  "symbol": "globe.europe.africa.fill",
  "official_url": "https://acmweb2027.org/important-dates/",
  "time_zone": "Europe/Dublin",
  "default_event_id": "www.paper",
  "events": [
    {
      "id": "www.abstract",
      "title": "摘要提交截止",
      "compact_title": "WWW 摘要",
      "at": "2026-10-18T23:59:59-12:00",
      "date_label": "2026 年 10 月 18 日 23:59:59 AoE",
      "detail_label": "北京时间 2026 年 10 月 19 日 19:59:59",
      "symbol": "doc.text"
    },
    {
      "id": "www.paper",
      "title": "全文提交截止",
      "compact_title": "WWW 全文",
      "at": "2026-10-25T23:59:59-12:00",
      "date_label": "2026 年 10 月 25 日 23:59:59 AoE",
      "detail_label": "北京时间 2026 年 10 月 26 日 19:59:59",
      "symbol": "paperplane.fill"
    },
    {
      "id": "www.review",
      "title": "初审结果公布",
      "compact_title": "WWW 初审",
      "at": "2026-12-21T23:59:59-12:00",
      "date_label": "2026 年 12 月 21 日 23:59:59 AoE",
      "detail_label": "北京时间 2026 年 12 月 22 日 19:59:59",
      "symbol": "doc.text.fill"
    },
    {
      "id": "www.rebuttal",
      "title": "作者回复截止",
      "compact_title": "WWW 回复",
      "at": "2026-12-31T23:59:59-12:00",
      "date_label": "2026 年 12 月 31 日 23:59:59 AoE",
      "detail_label": "北京时间 2027 年 1 月 1 日 19:59:59",
      "symbol": "bubble.left.and.bubble.right.fill"
    },
    {
      "id": "www.decision",
      "title": "最终结果公布",
      "compact_title": "WWW 终审",
      "at": "2027-01-04T23:59:59-12:00",
      "date_label": "2027 年 1 月 4 日 23:59:59 AoE",
      "detail_label": "北京时间 2027 年 1 月 5 日 19:59:59",
      "symbol": "checkmark.seal.fill"
    },
    {
      "id": "www.conference",
      "title": "会议开幕",
      "compact_title": "WWW 开会",
      "at": "2027-05-10T00:00:00+01:00",
      "date_label": "2027 年 5 月 10–14 日",
      "detail_label": "爱尔兰 · 都柏林",
      "symbol": "building.columns.fill"
    }
  ]
}
