{
  "schema_version": 1,
  "last_verified": "2026-08-14",
  "id": "mm",
  "edition": 2027,
  "name": "ACM MM 2027",
  "short_name": "MM",
  "subtitle": "ACM Multimedia · Hong Kong",
  "symbol": "photo.on.rectangle.angled",
  "official_url": "https://www.acmmm.org/",
  "time_zone": "Asia/Hong_Kong",
  "default_event_id": "mm.paper",
  "events": [
    {
      "id": "mm.paper",
      "title": "全文提交截止",
      "compact_title": "MM 全文",
      "at": null,
      "date_label": "官方尚未公布",
      "detail_label": "公布后再更新提醒",
      "symbol": "paperplane",
      "historical_key": "paper_deadline",
      "target_year": 2027
    },
    {
      "id": "mm.review",
      "title": "评审意见公布",
      "compact_title": "MM 评审",
      "at": null,
      "date_label": "官方尚未公布",
      "detail_label": "公布后替换历史预测",
      "symbol": "doc.text.fill",
      "historical_key": "review_release",
      "target_year": 2027
    },
    {
      "id": "mm.rebuttal",
      "title": "作者回复截止",
      "compact_title": "MM 回复",
      "at": null,
      "date_label": "官方尚未公布",
      "detail_label": "公布后替换历史预测",
      "symbol": "bubble.left.and.bubble.right.fill",
      "historical_key": "rebuttal_deadline",
      "target_year": 2027
    },
    {
      "id": "mm.decision",
      "title": "最终结果公布",
      "compact_title": "MM 终审",
      "at": null,
      "date_label": "官方尚未公布",
      "detail_label": "公布后替换历史预测",
      "symbol": "checkmark.seal.fill",
      "historical_key": "final_decision",
      "target_year": 2027
    },
    {
      "id": "mm.conference",
      "title": "会议开幕",
      "compact_title": "MM 开会",
      "at": null,
      "date_label": "日期尚未公布",
      "detail_label": "中国香港",
      "symbol": "building.columns",
      "historical_key": "conference_start",
      "target_year": 2027
    }
  ]
}
